10:30:04.433521 IP6 fe80::ce32:e5ff:fe47:5d9d > ip6-allnodes: ICMP6, router advertisement, length 24
10:30:05.179076 IP GLUBS.47294 > 186.250.28.11.domain: 13635+ [1au] PTR? d.9.d.5.7.4.e.f.f.f.5.e.2.3.e.c.0.0.0.0.0.0.0.0.0.0.0.0.0.8.e.f.ip6.arpa. (101)
10:30:05.180372 IP 186.250.28.11.domain > GLUBS.47294: 13635 NXDomain* 0/1/1 (160)
10:30:05.180794 IP GLUBS.47294 > 186.250.28.11.domain: 13635+ PTR? d.9.d.5.7.4.e.f.f.f.5.e.2.3.e.c.0.0.0.0.0.0.0.0.0.0.0.0.0.8.e.f.ip6.arpa. (90)
10:30:05.181896 IP 186.250.28.11.domain > GLUBS.47294: 13635 NXDomain* 0/1/0 (149)
10:30:05.824227 IP eze03s36-in-f6.1e100.net.https > GLUBS.56494: Flags [P.], seq 2913361679:2913361752, ack 2400522914, win 294, options [nop,nop,TS val 612804176 ecr 1810936618], length 73
10:30:05.824732 IP GLUBS.56494 > eze03s36-in-f6.1e100.net.https: Flags [F.], seq 1, ack 73, win 501, options [nop,nop,TS val 1811176617 ecr 612804176], length 0
10:30:05.843740 IP eze03s36-in-f6.1e100.net.https > GLUBS.56494: Flags [F.], seq 73, ack 2, win 294, options [nop,nop,TS val 612804195 ecr 1811176617], length 0
10:30:05.843771 IP GLUBS.56494 > eze03s36-in-f6.1e100.net.https: Flags [.], ack 74, win 501, options [nop,nop,TS val 1811176636 ecr 612804195], length 0
10:30:05.876714 IP GLUBS.34830 > whatsapp-cdn-shv-01-gig2.fbcdn.net.https: Flags [P.], seq 2720615997:2720616035, ack 3888555358, win 15946, options [nop,nop,TS val 96148974 ecr 2463050116], length 38
10:30:05.901473 IP whatsapp-cdn-shv-01-gig2.fbcdn.net.https > GLUBS.34830: Flags [.], ack 38, win 985, options [nop,nop,TS val 2463075987 ecr 96148974], length 0
10:30:06.030533 IP whatsapp-cdn-shv-01-gig2.fbcdn.net.https > GLUBS.34830: Flags [P.], seq 1:46, ack 38, win 985, options [nop,nop,TS val 2463076116 ecr 96148974], length 45
10:30:06.030602 IP GLUBS.34830 > whatsapp-cdn-shv-01-gig2.fbcdn.net.https: Flags [.], ack 46, win 15946, options [nop,nop,TS val 96149128 ecr 2463076116], length 0
10:30:06.201333 IP GLUBS.54097 > 186.250.28.11.domain: 19139+ [1au] PTR? 11.28.250.186.in-addr.arpa. (55)
10:30:07.092628 IP GLUBS.55569 > 186.250.28.10.domain: 19139+ [1au] PTR? 11.28.250.186.in-addr.arpa. (55)
10:30:07.094023 IP 186.250.28.10.domain > GLUBS.55569: 19139 NXDomain 0/1/1 (126)
10:30:07.094251 IP GLUBS.55569 > 186.250.28.10.domain: 19139+ PTR? 11.28.250.186.in-addr.arpa. (44)
10:30:07.095248 IP 186.250.28.10.domain > GLUBS.55569: 19139 NXDomain 0/1/0 (115)
10:30:07.096896 IP GLUBS.50841 > 186.250.28.10.domain: 12941+ [1au] PTR? 107.30.168.192.in-addr.arpa. (56)
10:30:07.097733 IP 186.250.28.10.domain > GLUBS.50841: 12941 NXDomain* 0/1/1 (115)
10:30:07.097944 IP GLUBS.50841 > 186.250.28.10.domain: 12941+ PTR? 107.30.168.192.in-addr.arpa. (45)
10:30:07.098699 IP 186.250.28.10.domain > GLUBS.50841: 12941 NXDomain* 0/1/0 (104)
10:30:07.100060 IP GLUBS.46622 > 186.250.28.10.domain: 36978+ [1au] PTR? 166.30.217.172.in-addr.arpa. (56)
10:30:07.181207 IP 186.250.28.11.domain > GLUBS.54097: 19139 NXDomain 0/1/1 (126)
10:30:07.181287 IP GLUBS > 186.250.28.11: ICMP GLUBS udp port 54097 unreachable, length 162
10:30:07.433678 IP 186.250.28.10.domain > GLUBS.46622: 36978 2/0/1 PTR eze03s36-in-f6.1e100.net., PTR gru14s18-in-f6.1e100.net. (123)
10:30:07.435152 IP GLUBS.50376 > 186.250.28.10.domain: 33854+ [1au] PTR? 52.74.13.31.in-addr.arpa. (53)
10:30:07.436182 IP 186.250.28.10.domain > GLUBS.50376: 33854 1/0/1 PTR whatsapp-cdn-shv-01-gig2.fbcdn.net. (101)
10:30:07.437302 IP GLUBS.46354 > 186.250.28.10.domain: 44527+ [1au] PTR? 10.28.250.186.in-addr.arpa. (55)
10:30:07.438200 IP 186.250.28.10.domain > GLUBS.46354: 44527 NXDomain 0/1/1 (126)
10:30:07.438514 IP GLUBS.46354 > 186.250.28.10.domain: 44527+ PTR? 10.28.250.186.in-addr.arpa. (44)
10:30:07.439670 IP 186.250.28.10.domain > GLUBS.46354: 44527 NXDomain 0/1/0 (115)
10:30:08.745609 IP6 fe80::ce32:e5ff:fe47:5d9d > ip6-allnodes: ICMP6, router advertisement, length 24
10:30:08.876579 IP GLUBS.39286 > 44.224.186.35.bc.googleusercontent.com.https: Flags [P.], seq 686075787:686075830, ack 1719584993, win 501, options [nop,nop,TS val 776336894 ecr 2378503130], length 43
10:30:08.896425 IP 44.224.186.35.bc.googleusercontent.com.https > GLUBS.39286: Flags [.], ack 43, win 272, options [nop,nop,TS val 2378533991 ecr 776336894], length 0
10:30:09.035425 IP 44.224.186.35.bc.googleusercontent.com.https > GLUBS.39286: Flags [P.], seq 1:41, ack 43, win 272, options [nop,nop,TS val 2378534130 ecr 776336894], length 40
10:30:09.035480 IP GLUBS.39286 > 44.224.186.35.bc.googleusercontent.com.https: Flags [.], ack 41, win 501, options [nop,nop,TS val 776337053 ecr 2378534130], length 0
10:30:09.273565 IP GLUBS.50485 > 186.250.28.10.domain: 5004+ [1au] PTR? 44.224.186.35.in-addr.arpa. (55)
10:30:09.356552 IP GLUBS.41322 > 25.224.186.35.bc.googleusercontent.com.https: Flags [P.], seq 3318442285:3318442412, ack 3382194633, win 4066, options [nop,nop,TS val 2135893467 ecr 3557241585], length 127
10:30:09.356665 IP GLUBS.41322 > 25.224.186.35.bc.googleusercontent.com.https: Flags [P.], seq 127:166, ack 1, win 4066, options [nop,nop,TS val 2135893467 ecr 3557241585], length 39
10:30:09.356721 IP GLUBS.41322 > 25.224.186.35.bc.googleusercontent.com.https: Flags [P.], seq 166:343, ack 1, win 4066, options [nop,nop,TS val 2135893467 ecr 3557241585], length 177
10:30:09.375748 IP 25.224.186.35.bc.googleusercontent.com.https > GLUBS.41322: Flags [.], ack 127, win 1050, options [nop,nop,TS val 3557269610 ecr 2135893467], length 0
10:30:09.375752 IP 25.224.186.35.bc.googleusercontent.com.https > GLUBS.41322: Flags [.], ack 166, win 1050, options [nop,nop,TS val 3557269610 ecr 2135893467], length 0
10:30:09.375812 IP 25.224.186.35.bc.googleusercontent.com.https > GLUBS.41322: Flags [.], ack 343, win 1050, options [nop,nop,TS val 3557269610 ecr 2135893467], length 0
10:30:09.376262 IP 25.224.186.35.bc.googleusercontent.com.https > GLUBS.41322: Flags [P.], seq 1:40, ack 343, win 1050, options [nop,nop,TS val 3557269610 ecr 2135893467], length 39
10:30:09.376304 IP GLUBS.41322 > 25.224.186.35.bc.googleusercontent.com.https: Flags [.], ack 40, win 4066, options [nop,nop,TS val 2135893487 ecr 3557269610], length 0
10:30:09.416045 IP 186.250.28.10.domain > GLUBS.50485: 5004 1/0/1 PTR 44.224.186.35.bc.googleusercontent.com. (107)
10:30:09.537758 IP 25.224.186.35.bc.googleusercontent.com.https > GLUBS.41322: Flags [P.], seq 40:115, ack 343, win 1050, options [nop,nop,TS val 3557269772 ecr 2135893487], length 75
10:30:09.537815 IP GLUBS.41322 > 25.224.186.35.bc.googleusercontent.com.https: Flags [.], ack 115, win 4066, options [nop,nop,TS val 2135893648 ecr 3557269772], length 0
10:30:09.537955 IP 25.224.186.35.bc.googleusercontent.com.https > GLUBS.41322: Flags [P.], seq 115:1533, ack 343, win 1050, options [nop,nop,TS val 3557269772 ecr 2135893487], length 1418
10:30:09.538012 IP GLUBS.41322 > 25.224.186.35.bc.googleusercontent.com.https: Flags [.], ack 1533, win 4089, options [nop,nop,TS val 2135893648 ecr 3557269772], length 0
10:30:09.538240 IP 25.224.186.35.bc.googleusercontent.com.https > GLUBS.41322: Flags [.], seq 1533:2951, ack 343, win 1050, options [nop,nop,TS val 3557269772 ecr 2135893487], length 1418
10:30:09.538272 IP GLUBS.41322 > 25.224.186.35.bc.googleusercontent.com.https: Flags [.], ack 2951, win 4112, options [nop,nop,TS val 2135893649 ecr 3557269772], length 0
10:30:09.538325 IP 25.224.186.35.bc.googleusercontent.com.https > GLUBS.41322: Flags [P.], seq 2951:3971, ack 343, win 1050, options [nop,nop,TS val 3557269772 ecr 2135893487], length 1020
10:30:09.538338 IP GLUBS.41322 > 25.224.186.35.bc.googleusercontent.com.https: Flags [.], ack 3971, win 4134, options [nop,nop,TS val 2135893649 ecr 3557269772], length 0
10:30:09.538813 IP 25.224.186.35.bc.googleusercontent.com.https > GLUBS.41322: Flags [P.], seq 3971:4010, ack 343, win 1050, options [nop,nop,TS val 3557269773 ecr 2135893487], length 39
10:30:09.538839 IP GLUBS.41322 > 25.224.186.35.bc.googleusercontent.com.https: Flags [.], ack 4010, win 4134, options [nop,nop,TS val 2135893649 ecr 3557269773], length 0
10:30:09.541524 IP GLUBS.41322 > 25.224.186.35.bc.googleusercontent.com.https: Flags [P.], seq 343:382, ack 4010, win 4134, options [nop,nop,TS val 2135893652 ecr 3557269773], length 39
10:30:09.564902 IP 25.224.186.35.bc.googleusercontent.com.https > GLUBS.41322: Flags [.], ack 382, win 1050, options [nop,nop,TS val 3557269799 ecr 2135893652], length 0
10:30:09.572079 IP GLUBS.41322 > 25.224.186.35.bc.googleusercontent.com.https: Flags [P.], seq 382:487, ack 4010, win 4134, options [nop,nop,TS val 2135893682 ecr 3557269799], length 105
10:30:09.572180 IP GLUBS.41322 > 25.224.186.35.bc.googleusercontent.com.https: Flags [P.], seq 487:1054, ack 4010, win 4134, options [nop,nop,TS val 2135893682 ecr 3557269799], length 567
10:30:09.573722 IP GLUBS.41322 > 25.224.186.35.bc.googleusercontent.com.https: Flags [P.], seq 1054:1134, ack 4010, win 4134, options [nop,nop,TS val 2135893684 ecr 3557269799], length 80
10:30:09.573833 IP GLUBS.41322 > 25.224.186.35.bc.googleusercontent.com.https: Flags [P.], seq 1134:1639, ack 4010, win 4134, options [nop,nop,TS val 2135893684 ecr 3557269799], length 505
10:30:09.590856 IP 25.224.186.35.bc.googleusercontent.com.https > GLUBS.41322: Flags [.], ack 487, win 1050, options [nop,nop,TS val 3557269825 ecr 2135893682], length 0
10:30:09.591387 IP 25.224.186.35.bc.googleusercontent.com.https > GLUBS.41322: Flags [.], ack 1054, win 1050, options [nop,nop,TS val 3557269825 ecr 2135893682], length 0
10:30:09.592828 IP 25.224.186.35.bc.googleusercontent.com.https > GLUBS.41322: Flags [.], ack 1134, win 1050, options [nop,nop,TS val 3557269827 ecr 2135893684], length 0
10:30:09.592834 IP 25.224.186.35.bc.googleusercontent.com.https > GLUBS.41322: Flags [.], ack 1639, win 1050, options [nop,nop,TS val 3557269827 ecr 2135893684], length 0
10:30:09.854735 IP 25.224.186.35.bc.googleusercontent.com.https > GLUBS.41322: Flags [P.], seq 4010:4096, ack 1639, win 1050, options [nop,nop,TS val 3557270089 ecr 2135893684], length 86
10:30:09.854827 IP GLUBS.41322 > 25.224.186.35.bc.googleusercontent.com.https: Flags [.], ack 4096, win 4134, options [nop,nop,TS val 2135893965 ecr 3557270089], length 0
10:30:09.854852 IP 25.224.186.35.bc.googleusercontent.com.https > GLUBS.41322: Flags [P.], seq 4096:4165, ack 1639, win 1050, options [nop,nop,TS val 3557270089 ecr 2135893684], length 69
10:30:09.854868 IP GLUBS.41322 > 25.224.186.35.bc.googleusercontent.com.https: Flags [.], ack 4165, win 4134, options [nop,nop,TS val 2135893965 ecr 3557270089], length 0
10:30:09.859144 IP GLUBS.41322 > 25.224.186.35.bc.googleusercontent.com.https: Flags [P.], seq 1639:1678, ack 4165, win 4134, options [nop,nop,TS val 2135893969 ecr 3557270089], length 39
10:30:09.878299 IP 25.224.186.35.bc.googleusercontent.com.https > GLUBS.41322: Flags [.], ack 1678, win 1050, options [nop,nop,TS val 3557270112 ecr 2135893969], length 0
10:30:10.040064 IP GLUBS.56002 > 47.224.186.35.bc.googleusercontent.com.https: Flags [P.], seq 2522394769:2522394804, ack 2832627114, win 501, options [nop,nop,TS val 716664796 ecr 3477827334], length 35
10:30:10.058152 IP 47.224.186.35.bc.googleusercontent.com.https > GLUBS.56002: Flags [.], ack 35, win 266, options [nop,nop,TS val 3477858184 ecr 716664796], length 0
10:30:10.196920 IP 47.224.186.35.bc.googleusercontent.com.https > GLUBS.56002: Flags [P.], seq 1:32, ack 35, win 266, options [nop,nop,TS val 3477858323 ecr 716664796], length 31
10:30:10.197020 IP GLUBS.56002 > 47.224.186.35.bc.googleusercontent.com.https: Flags [.], ack 32, win 501, options [nop,nop,TS val 716664953 ecr 3477858323], length 0
10:30:10.297061 IP GLUBS.60831 > 186.250.28.10.domain: 62229+ [1au] PTR? 25.224.186.35.in-addr.arpa. (55)
10:30:10.430321 IP relay-f727fc62.net.anydesk.com.http > GLUBS.39651: Flags [.], ack 1412263175, win 501, options [nop,nop,TS val 200937217 ecr 1022194413], length 0
10:30:10.430396 IP GLUBS.39651 > relay-f727fc62.net.anydesk.com.http: Flags [.], ack 1, win 501, options [nop,nop,TS val 1022204654 ecr 200900789], length 0
10:30:10.464888 IP 186.250.28.10.domain > GLUBS.60831: 62229 1/0/1 PTR 25.224.186.35.bc.googleusercontent.com. (107)
10:30:10.467015 IP GLUBS.50525 > 186.250.28.10.domain: 37731+ [1au] PTR? 47.224.186.35.in-addr.arpa. (55)
10:30:10.634330 IP 186.250.28.10.domain > GLUBS.50525: 37731 1/0/1 PTR 47.224.186.35.bc.googleusercontent.com. (107)
10:30:10.840442 IP GLUBS.35888 > 199.232.114.248.https: Flags [.], ack 294167899, win 501, options [nop,nop,TS val 3193944903 ecr 3398642629], length 0
10:30:10.840460 IP GLUBS.41210 > 25.224.186.35.bc.googleusercontent.com.https: Flags [.], ack 121616739, win 501, options [nop,nop,TS val 2135894951 ecr 3511885377], length 0
10:30:10.840463 IP GLUBS.35884 > 199.232.114.248.https: Flags [.], ack 1470633521, win 953, options [nop,nop,TS val 3193944903 ecr 2342355969], length 0
10:30:10.840465 IP GLUBS.49786 > gru06s69-in-f5.1e100.net.https: Flags [.], ack 124850719, win 501, options [nop,nop,TS val 2286538864 ecr 3338600758], length 0
10:30:10.855639 IP 199.232.114.248.https > GLUBS.35884: Flags [.], ack 1, win 292, options [nop,nop,TS val 2342402593 ecr 3193898295], length 0
10:30:10.855643 IP 199.232.114.248.https > GLUBS.35888: Flags [.], ack 1, win 292, options [nop,nop,TS val 3398689194 ecr 3193898352], length 0
10:30:10.858142 IP gru06s69-in-f5.1e100.net.https > GLUBS.49786: Flags [.], ack 1, win 328, options [nop,nop,TS val 3338645809 ecr 2286357555], length 0
10:30:10.860418 IP 25.224.186.35.bc.googleusercontent.com.https > GLUBS.41210: Flags [.], ack 1, win 344, options [nop,nop,TS val 3511931597 ecr 2135848726], length 0
10:30:11.321515 IP GLUBS.60063 > 186.250.28.10.domain: 57773+ [1au] PTR? 23.150.38.92.in-addr.arpa. (54)
10:30:11.322660 IP 186.250.28.10.domain > GLUBS.60063: 57773 1/0/1 PTR relay-f727fc62.net.anydesk.com. (98)
10:30:11.324073 IP GLUBS.33167 > 186.250.28.10.domain: 19367+ [1au] PTR? 248.114.232.199.in-addr.arpa. (57)
10:30:11.325219 IP 186.250.28.10.domain > GLUBS.33167: 19367 NXDomain 0/1/1 (111)
10:30:11.325471 IP GLUBS.33167 > 186.250.28.10.domain: 19367+ PTR? 248.114.232.199.in-addr.arpa. (46)
10:30:11.326586 IP 186.250.28.10.domain > GLUBS.33167: 19367 NXDomain 0/1/0 (100)
10:30:11.328452 IP GLUBS.54123 > 186.250.28.10.domain: 9285+ [1au] PTR? 69.128.251.142.in-addr.arpa. (56)
10:30:11.329643 IP 186.250.28.10.domain > GLUBS.54123: 9285 1/0/1 PTR gru06s69-in-f5.1e100.net. (94)
10:30:11.900513 IP GLUBS.33816 > 186.250.28.10.domain: 2374+ [1au] A? xpui.app.spotify.com. (49)
10:30:11.901438 IP 186.250.28.10.domain > GLUBS.33816: 2374 NXDomain 0/1/1 (114)
10:30:11.901758 IP GLUBS.33816 > 186.250.28.10.domain: 2374+ A? xpui.app.spotify.com. (38)
10:30:11.903013 IP 186.250.28.10.domain > GLUBS.33816: 2374 NXDomain 0/1/0 (103)
10:30:12.358305 IP GLUBS.48113 > cf-in-f189.1e100.net.443: UDP, length 33
10:30:12.437245 IP cf-in-f189.1e100.net.443 > GLUBS.48113: UDP, length 26
10:30:13.369265 IP GLUBS.48064 > 186.250.28.10.domain: 25277+ [1au] PTR? 189.192.217.172.in-addr.arpa. (57)
10:30:13.370321 IP 186.250.28.10.domain > GLUBS.48064: 25277 1/0/1 PTR cf-in-f189.1e100.net. (91)
10:30:14.207142 IP GLUBS.34830 > whatsapp-cdn-shv-01-gig2.fbcdn.net.https: Flags [P.], seq 38:165, ack 46, win 15946, options [nop,nop,TS val 96157304 ecr 2463076116], length 127
10:30:14.208947 IP GLUBS.34830 > whatsapp-cdn-shv-01-gig2.fbcdn.net.https: Flags [P.], seq 165:342, ack 46, win 15946, options [nop,nop,TS val 96157306 ecr 2463076116], length 177
10:30:14.213926 IP GLUBS.50498 > 186.250.28.10.domain: 20425+ [1au] A? web.whatsapp.com. (45)
10:30:14.214967 IP 186.250.28.10.domain > GLUBS.50498: 20425 2/0/1 CNAME mmx-ds.cdn.whatsapp.net., A 31.13.74.52 (98)
10:30:14.215479 IP GLUBS.35572 > whatsapp-cdn-shv-01-gig2.fbcdn.net.https: Flags [S], seq 984195530, win 64240, options [mss 1460,sackOK,TS val 96157313 ecr 0,nop,wscale 7], length 0
10:30:14.231783 IP whatsapp-cdn-shv-01-gig2.fbcdn.net.https > GLUBS.34830: Flags [.], ack 165, win 985, options [nop,nop,TS val 2463084317 ecr 96157304], length 0
10:30:14.233204 IP whatsapp-cdn-shv-01-gig2.fbcdn.net.https > GLUBS.34830: Flags [.], ack 342, win 996, options [nop,nop,TS val 2463084319 ecr 96157306], length 0
10:30:14.240547 IP whatsapp-cdn-shv-01-gig2.fbcdn.net.https > GLUBS.35572: Flags [S.], seq 2455785305, ack 984195531, win 65535, options [mss 1392,sackOK,TS val 1544756713 ecr 96157313,nop,wscale 8], length 0
10:30:14.240623 IP GLUBS.35572 > whatsapp-cdn-shv-01-gig2.fbcdn.net.https: Flags [.], ack 1, win 502, options [nop,nop,TS val 96157338 ecr 1544756713], length 0
10:30:14.240892 IP GLUBS.35572 > whatsapp-cdn-shv-01-gig2.fbcdn.net.https: Flags [P.], seq 1:518, ack 1, win 502, options [nop,nop,TS val 96157338 ecr 1544756713], length 517
10:30:14.266322 IP whatsapp-cdn-shv-01-gig2.fbcdn.net.https > GLUBS.35572: Flags [.], ack 518, win 261, options [nop,nop,TS val 1544756739 ecr 96157338], length 0
10:30:14.268630 IP whatsapp-cdn-shv-01-gig2.fbcdn.net.https > GLUBS.35572: Flags [P.], seq 1:151, ack 518, win 261, options [nop,nop,TS val 1544756741 ecr 96157338], length 150
10:30:14.268655 IP GLUBS.35572 > whatsapp-cdn-shv-01-gig2.fbcdn.net.https: Flags [.], ack 151, win 501, options [nop,nop,TS val 96157366 ecr 1544756741], length 0
10:30:14.268812 IP GLUBS.35572 > whatsapp-cdn-shv-01-gig2.fbcdn.net.https: Flags [P.], seq 518:569, ack 151, win 501, options [nop,nop,TS val 96157366 ecr 1544756741], length 51
10:30:14.269840 IP GLUBS.35572 > whatsapp-cdn-shv-01-gig2.fbcdn.net.https: Flags [P.], seq 569:662, ack 151, win 501, options [nop,nop,TS val 96157367 ecr 1544756741], length 93
10:30:14.269973 IP GLUBS.35572 > whatsapp-cdn-shv-01-gig2.fbcdn.net.https: Flags [P.], seq 662:896, ack 151, win 501, options [nop,nop,TS val 96157367 ecr 1544756741], length 234
10:30:14.293808 IP whatsapp-cdn-shv-01-gig2.fbcdn.net.https > GLUBS.35572: Flags [.], ack 569, win 261, options [nop,nop,TS val 1544756766 ecr 96157366], length 0
10:30:14.294059 IP whatsapp-cdn-shv-01-gig2.fbcdn.net.https > GLUBS.35572: Flags [P.], seq 151:238, ack 569, win 261, options [nop,nop,TS val 1544756767 ecr 96157366], length 87
10:30:14.294072 IP GLUBS.35572 > whatsapp-cdn-shv-01-gig2.fbcdn.net.https: Flags [.], ack 238, win 501, options [nop,nop,TS val 96157391 ecr 1544756767], length 0
10:30:14.294208 IP GLUBS.35572 > whatsapp-cdn-shv-01-gig2.fbcdn.net.https: Flags [P.], seq 896:934, ack 238, win 501, options [nop,nop,TS val 96157391 ecr 1544756767], length 38
10:30:14.294859 IP whatsapp-cdn-shv-01-gig2.fbcdn.net.https > GLUBS.35572: Flags [.], ack 662, win 261, options [nop,nop,TS val 1544756767 ecr 96157367], length 0
10:30:14.294861 IP whatsapp-cdn-shv-01-gig2.fbcdn.net.https > GLUBS.35572: Flags [.], ack 896, win 265, options [nop,nop,TS val 1544756767 ecr 96157367], length 0
10:30:14.294861 IP whatsapp-cdn-shv-01-gig2.fbcdn.net.https > GLUBS.35572: Flags [P.], seq 238:276, ack 896, win 265, options [nop,nop,TS val 1544756767 ecr 96157367], length 38
10:30:14.294883 IP GLUBS.35572 > whatsapp-cdn-shv-01-gig2.fbcdn.net.https: Flags [.], ack 276, win 501, options [nop,nop,TS val 96157392 ecr 1544756767], length 0
10:30:14.295119 IP whatsapp-cdn-shv-01-gig2.fbcdn.net.https > GLUBS.35572: Flags [P.], seq 276:318, ack 896, win 265, options [nop,nop,TS val 1544756768 ecr 96157367], length 42
10:30:14.295124 IP GLUBS.35572 > whatsapp-cdn-shv-01-gig2.fbcdn.net.https: Flags [.], ack 318, win 501, options [nop,nop,TS val 96157392 ecr 1544756768], length 0
10:30:14.318822 IP whatsapp-cdn-shv-01-gig2.fbcdn.net.https > GLUBS.35572: Flags [.], ack 934, win 265, options [nop,nop,TS val 1544756791 ecr 96157391], length 0
10:30:14.360915 IP whatsapp-cdn-shv-01-gig2.fbcdn.net.https > GLUBS.34830: Flags [P.], seq 46:87, ack 342, win 996, options [nop,nop,TS val 2463084447 ecr 96157306], length 41
10:30:14.360986 IP GLUBS.34830 > whatsapp-cdn-shv-01-gig2.fbcdn.net.https: Flags [.], ack 87, win 15946, options [nop,nop,TS val 96157458 ecr 2463084447], length 0
10:30:14.362220 IP whatsapp-cdn-shv-01-gig2.fbcdn.net.https > GLUBS.34830: Flags [P.], seq 87:128, ack 342, win 996, options [nop,nop,TS val 2463084448 ecr 96157306], length 41
10:30:14.362277 IP GLUBS.34830 > whatsapp-cdn-shv-01-gig2.fbcdn.net.https: Flags [.], ack 128, win 15946, options [nop,nop,TS val 96157460 ecr 2463084448], length 0
10:30:14.413342 IP whatsapp-cdn-shv-01-gig2.fbcdn.net.https > GLUBS.35572: Flags [P.], seq 318:1687, ack 934, win 265, options [nop,nop,TS val 1544756886 ecr 96157392], length 1369
10:30:14.413373 IP GLUBS.35572 > whatsapp-cdn-shv-01-gig2.fbcdn.net.https: Flags [.], ack 1687, win 501, options [nop,nop,TS val 96157511 ecr 1544756886], length 0
10:30:14.714109 IP whatsapp-cdn-shv-01-gig2.fbcdn.net.https > GLUBS.34830: Flags [P.], seq 128:183, ack 342, win 996, options [nop,nop,TS val 2463084800 ecr 96157460], length 55
10:30:14.714174 IP GLUBS.34830 > whatsapp-cdn-shv-01-gig2.fbcdn.net.https: Flags [.], ack 183, win 15946, options [nop,nop,TS val 96157811 ecr 2463084800], length 0
10:30:14.740582 IP whatsapp-cdn-shv-01-gig2.fbcdn.net.https > GLUBS.34830: Flags [P.], seq 183:238, ack 342, win 996, options [nop,nop,TS val 2463084826 ecr 96157811], length 55
10:30:14.740605 IP GLUBS.34830 > whatsapp-cdn-shv-01-gig2.fbcdn.net.https: Flags [.], ack 238, win 15946, options [nop,nop,TS val 96157838 ecr 2463084826], length 0
10:30:15.333524 IP6 fe80::ce32:e5ff:fe47:5d9d > ip6-allnodes: ICMP6, router advertisement, length 24
10:30:16.984248 IP GLUBS.36374 > a23-63-29-18.deploy.static.akamaitechnologies.com.https: Flags [.], ack 3606574791, win 19959, options [nop,nop,TS val 1903441171 ecr 2298240256], length 0
10:30:17.000145 IP a23-63-29-18.deploy.static.akamaitechnologies.com.https > GLUBS.36374: Flags [.], ack 1, win 403, options [nop,nop,TS val 2298287106 ecr 1903394341], length 0
10:30:17.464542 IP GLUBS.44090 > 186.250.28.10.domain: 53861+ [1au] PTR? 18.29.63.23.in-addr.arpa. (53)
10:30:17.465522 IP 186.250.28.10.domain > GLUBS.44090: 53861 1/0/1 PTR a23-63-29-18.deploy.static.akamaitechnologies.com. (116)
10:30:18.014728 IP GLUBS.34830 > whatsapp-cdn-shv-01-gig2.fbcdn.net.https: Flags [P.], seq 342:501, ack 238, win 15946, options [nop,nop,TS val 96161112 ecr 2463084826], length 159
10:30:18.039188 IP whatsapp-cdn-shv-01-gig2.fbcdn.net.https > GLUBS.34830: Flags [.], ack 501, win 1006, options [nop,nop,TS val 2463088125 ecr 96161112], length 0
10:30:18.168403 IP whatsapp-cdn-shv-01-gig2.fbcdn.net.https > GLUBS.34830: Flags [P.], seq 238:279, ack 501, win 1006, options [nop,nop,TS val 2463088254 ecr 96161112], length 41
10:30:18.168428 IP GLUBS.34830 > whatsapp-cdn-shv-01-gig2.fbcdn.net.https: Flags [.], ack 279, win 15946, options [nop,nop,TS val 96161266 ecr 2463088254], length 0
10:30:18.178504 IP GLUBS.34830 > whatsapp-cdn-shv-01-gig2.fbcdn.net.https: Flags [P.], seq 501:568, ack 279, win 15946, options [nop,nop,TS val 96161276 ecr 2463088254], length 67
10:30:18.180566 IP GLUBS.41742 > 186.250.28.10.domain: 50491+ [1au] A? media-gru1-1.cdn.whatsapp.net. (58)
10:30:18.181334 IP 186.250.28.10.domain > GLUBS.41742: 50491 1/0/1 A 157.240.222.60 (74)
10:30:18.181513 IP GLUBS.56284 > whatsapp-cdn-shv-01-gru1.fbcdn.net.https: Flags [S], seq 2749897469, win 64240, options [mss 1460,sackOK,TS val 3846260134 ecr 0,nop,wscale 7], length 0
10:30:18.197396 IP whatsapp-cdn-shv-01-gru1.fbcdn.net.https > GLUBS.56284: Flags [S.], seq 3226584811, ack 2749897470, win 65535, options [mss 1392,sackOK,TS val 636101010 ecr 3846260134,nop,wscale 8], length 0
10:30:18.197426 IP GLUBS.56284 > whatsapp-cdn-shv-01-gru1.fbcdn.net.https: Flags [.], ack 1, win 502, options [nop,nop,TS val 3846260150 ecr 636101010], length 0
10:30:18.197517 IP GLUBS.56284 > whatsapp-cdn-shv-01-gru1.fbcdn.net.https: Flags [P.], seq 1:221, ack 1, win 502, options [nop,nop,TS val 3846260150 ecr 636101010], length 220
10:30:18.202855 IP whatsapp-cdn-shv-01-gig2.fbcdn.net.https > GLUBS.34830: Flags [.], ack 568, win 1006, options [nop,nop,TS val 2463088289 ecr 96161276], length 0
10:30:18.213285 IP whatsapp-cdn-shv-01-gru1.fbcdn.net.https > GLUBS.56284: Flags [.], ack 221, win 261, options [nop,nop,TS val 636101026 ecr 3846260150], length 0
10:30:18.214032 IP whatsapp-cdn-shv-01-gru1.fbcdn.net.https > GLUBS.56284: Flags [.], seq 1:1381, ack 221, win 261, options [nop,nop,TS val 636101027 ecr 3846260150], length 1380
10:30:18.214041 IP GLUBS.56284 > whatsapp-cdn-shv-01-gru1.fbcdn.net.https: Flags [.], ack 1381, win 501, options [nop,nop,TS val 3846260166 ecr 636101027], length 0
10:30:18.214147 IP whatsapp-cdn-shv-01-gru1.fbcdn.net.https > GLUBS.56284: Flags [P.], seq 1381:2761, ack 221, win 261, options [nop,nop,TS val 636101027 ecr 3846260150], length 1380
10:30:18.214150 IP GLUBS.56284 > whatsapp-cdn-shv-01-gru1.fbcdn.net.https: Flags [.], ack 2761, win 501, options [nop,nop,TS val 3846260166 ecr 636101027], length 0
10:30:18.214176 IP whatsapp-cdn-shv-01-gru1.fbcdn.net.https > GLUBS.56284: Flags [P.], seq 2761:3089, ack 221, win 261, options [nop,nop,TS val 636101027 ecr 3846260150], length 328
10:30:18.214179 IP GLUBS.56284 > whatsapp-cdn-shv-01-gru1.fbcdn.net.https: Flags [.], ack 3089, win 501, options [nop,nop,TS val 3846260166 ecr 636101027], length 0
10:30:18.214571 IP GLUBS.56284 > whatsapp-cdn-shv-01-gru1.fbcdn.net.https: Flags [P.], seq 221:347, ack 3089, win 501, options [nop,nop,TS val 3846260167 ecr 636101027], length 126
10:30:18.215340 IP GLUBS.56284 > whatsapp-cdn-shv-01-gru1.fbcdn.net.https: Flags [P.], seq 347:440, ack 3089, win 501, options [nop,nop,TS val 3846260168 ecr 636101027], length 93
10:30:18.215423 IP GLUBS.56284 > whatsapp-cdn-shv-01-gru1.fbcdn.net.https: Flags [P.], seq 440:834, ack 3089, win 501, options [nop,nop,TS val 3846260168 ecr 636101027], length 394
10:30:18.230152 IP whatsapp-cdn-shv-01-gru1.fbcdn.net.https > GLUBS.56284: Flags [.], ack 347, win 261, options [nop,nop,TS val 636101043 ecr 3846260167], length 0
10:30:18.230428 IP whatsapp-cdn-shv-01-gru1.fbcdn.net.https > GLUBS.56284: Flags [P.], seq 3089:3363, ack 347, win 261, options [nop,nop,TS val 636101043 ecr 3846260167], length 274
10:30:18.230438 IP GLUBS.56284 > whatsapp-cdn-shv-01-gru1.fbcdn.net.https: Flags [.], ack 3363, win 501, options [nop,nop,TS val 3846260183 ecr 636101043], length 0
10:30:18.230516 IP whatsapp-cdn-shv-01-gru1.fbcdn.net.https > GLUBS.56284: Flags [P.], seq 3363:3450, ack 347, win 261, options [nop,nop,TS val 636101044 ecr 3846260167], length 87
10:30:18.230520 IP GLUBS.56284 > whatsapp-cdn-shv-01-gru1.fbcdn.net.https: Flags [.], ack 3450, win 501, options [nop,nop,TS val 3846260183 ecr 636101044], length 0
10:30:18.230568 IP GLUBS.56284 > whatsapp-cdn-shv-01-gru1.fbcdn.net.https: Flags [P.], seq 834:872, ack 3450, win 501, options [nop,nop,TS val 3846260183 ecr 636101044], length 38
10:30:18.231099 IP whatsapp-cdn-shv-01-gru1.fbcdn.net.https > GLUBS.56284: Flags [.], ack 440, win 261, options [nop,nop,TS val 636101044 ecr 3846260168], length 0
10:30:18.231108 IP whatsapp-cdn-shv-01-gru1.fbcdn.net.https > GLUBS.56284: Flags [.], ack 834, win 265, options [nop,nop,TS val 636101044 ecr 3846260168], length 0
10:30:18.231191 IP whatsapp-cdn-shv-01-gru1.fbcdn.net.https > GLUBS.56284: Flags [P.], seq 3450:3488, ack 834, win 265, options [nop,nop,TS val 636101044 ecr 3846260168], length 38
10:30:18.231195 IP GLUBS.56284 > whatsapp-cdn-shv-01-gru1.fbcdn.net.https: Flags [.], ack 3488, win 501, options [nop,nop,TS val 3846260183 ecr 636101044], length 0
10:30:18.231430 IP whatsapp-cdn-shv-01-gru1.fbcdn.net.https > GLUBS.56284: Flags [P.], seq 3488:3530, ack 834, win 265, options [nop,nop,TS val 636101044 ecr 3846260168], length 42
10:30:18.231437 IP GLUBS.56284 > whatsapp-cdn-shv-01-gru1.fbcdn.net.https: Flags [.], ack 3530, win 501, options [nop,nop,TS val 3846260184 ecr 636101044], length 0
10:30:18.232588 IP whatsapp-cdn-shv-01-gru1.fbcdn.net.https > GLUBS.56284: Flags [P.], seq 3530:3905, ack 834, win 265, options [nop,nop,TS val 636101046 ecr 3846260168], length 375
10:30:18.232596 IP GLUBS.56284 > whatsapp-cdn-shv-01-gru1.fbcdn.net.https: Flags [.], ack 3905, win 501, options [nop,nop,TS val 3846260185 ecr 636101046], length 0
10:30:18.233713 IP whatsapp-cdn-shv-01-gru1.fbcdn.net.https > GLUBS.56284: Flags [.], seq 3905:5285, ack 834, win 265, options [nop,nop,TS val 636101046 ecr 3846260168], length 1380
10:30:18.233759 IP GLUBS.56284 > whatsapp-cdn-shv-01-gru1.fbcdn.net.https: Flags [.], ack 5285, win 501, options [nop,nop,TS val 3846260186 ecr 636101046], length 0
10:30:18.233810 IP whatsapp-cdn-shv-01-gru1.fbcdn.net.https > GLUBS.56284: Flags [.], seq 5285:6665, ack 834, win 265, options [nop,nop,TS val 636101046 ecr 3846260168], length 1380
10:30:18.233815 IP GLUBS.56284 > whatsapp-cdn-shv-01-gru1.fbcdn.net.https: Flags [.], ack 6665, win 501, options [nop,nop,TS val 3846260186 ecr 636101046], length 0
10:30:18.233928 IP whatsapp-cdn-shv-01-gru1.fbcdn.net.https > GLUBS.56284: Flags [P.], seq 6665:8045, ack 834, win 265, options [nop,nop,TS val 636101046 ecr 3846260168], length 1380
10:30:18.233935 IP GLUBS.56284 > whatsapp-cdn-shv-01-gru1.fbcdn.net.https: Flags [.], ack 8045, win 501, options [nop,nop,TS val 3846260186 ecr 636101046], length 0
10:30:18.234825 IP whatsapp-cdn-shv-01-gru1.fbcdn.net.https > GLUBS.56284: Flags [.], seq 8045:9425, ack 834, win 265, options [nop,nop,TS val 636101048 ecr 3846260168], length 1380
10:30:18.234842 IP GLUBS.56284 > whatsapp-cdn-shv-01-gru1.fbcdn.net.https: Flags [.], ack 9425, win 501, options [nop,nop,TS val 3846260187 ecr 636101048], length 0
10:30:18.234939 IP whatsapp-cdn-shv-01-gru1.fbcdn.net.https > GLUBS.56284: Flags [P.], seq 9425:10805, ack 834, win 265, options [nop,nop,TS val 636101048 ecr 3846260168], length 1380
10:30:18.235874 IP whatsapp-cdn-shv-01-gru1.fbcdn.net.https > GLUBS.56284: Flags [.], seq 10805:12185, ack 834, win 265, options [nop,nop,TS val 636101049 ecr 3846260168], length 1380
10:30:18.235885 IP GLUBS.56284 > whatsapp-cdn-shv-01-gru1.fbcdn.net.https: Flags [.], ack 12185, win 501, options [nop,nop,TS val 3846260188 ecr 636101048], length 0
10:30:18.236481 IP whatsapp-cdn-shv-01-gru1.fbcdn.net.https > GLUBS.56284: Flags [.], seq 12185:13565, ack 834, win 265, options [nop,nop,TS val 636101049 ecr 3846260168], length 1380
10:30:18.236592 IP whatsapp-cdn-shv-01-gru1.fbcdn.net.https > GLUBS.56284: Flags [P.], seq 13565:14945, ack 834, win 265, options [nop,nop,TS val 636101049 ecr 3846260168], length 1380
10:30:18.236609 IP GLUBS.56284 > whatsapp-cdn-shv-01-gru1.fbcdn.net.https: Flags [.], ack 14945, win 501, options [nop,nop,TS val 3846260189 ecr 636101049], length 0
10:30:18.246609 IP whatsapp-cdn-shv-01-gru1.fbcdn.net.https > GLUBS.56284: Flags [.], seq 14945:16325, ack 834, win 265, options [nop,nop,TS val 636101059 ecr 3846260183], length 1380
10:30:18.246723 IP whatsapp-cdn-shv-01-gru1.fbcdn.net.https > GLUBS.56284: Flags [P.], seq 16325:17705, ack 834, win 265, options [nop,nop,TS val 636101059 ecr 3846260183], length 1380
10:30:18.246735 IP GLUBS.56284 > whatsapp-cdn-shv-01-gru1.fbcdn.net.https: Flags [.], ack 17705, win 524, options [nop,nop,TS val 3846260199 ecr 636101059], length 0
10:30:18.247136 IP whatsapp-cdn-shv-01-gru1.fbcdn.net.https > GLUBS.56284: Flags [.], seq 17705:19085, ack 834, win 265, options [nop,nop,TS val 636101060 ecr 3846260183], length 1380
10:30:18.247144 IP GLUBS.56284 > whatsapp-cdn-shv-01-gru1.fbcdn.net.https: Flags [.], ack 19085, win 546, options [nop,nop,TS val 3846260199 ecr 636101060], length 0
10:30:18.247248 IP whatsapp-cdn-shv-01-gru1.fbcdn.net.https > GLUBS.56284: Flags [P.], seq 19085:20465, ack 834, win 265, options [nop,nop,TS val 636101060 ecr 3846260183], length 1380
10:30:18.247255 IP GLUBS.56284 > whatsapp-cdn-shv-01-gru1.fbcdn.net.https: Flags [.], ack 20465, win 552, options [nop,nop,TS val 3846260200 ecr 636101060], length 0
10:30:18.247980 IP whatsapp-cdn-shv-01-gru1.fbcdn.net.https > GLUBS.56284: Flags [.], ack 872, win 265, options [nop,nop,TS val 636101061 ecr 3846260183], length 0
10:30:18.248207 IP whatsapp-cdn-shv-01-gru1.fbcdn.net.https > GLUBS.56284: Flags [.], seq 20465:21845, ack 872, win 265, options [nop,nop,TS val 636101061 ecr 3846260183], length 1380
10:30:18.248356 IP whatsapp-cdn-shv-01-gru1.fbcdn.net.https > GLUBS.56284: Flags [P.], seq 21845:23225, ack 872, win 265, options [nop,nop,TS val 636101061 ecr 3846260183], length 1380
10:30:18.248363 IP GLUBS.56284 > whatsapp-cdn-shv-01-gru1.fbcdn.net.https: Flags [.], ack 23225, win 552, options [nop,nop,TS val 3846260201 ecr 636101061], length 0
10:30:18.249362 IP whatsapp-cdn-shv-01-gru1.fbcdn.net.https > GLUBS.56284: Flags [.], seq 23225:24605, ack 872, win 265, options [nop,nop,TS val 636101062 ecr 3846260184], length 1380
10:30:18.249487 IP whatsapp-cdn-shv-01-gru1.fbcdn.net.https > GLUBS.56284: Flags [P.], seq 24605:25985, ack 872, win 265, options [nop,nop,TS val 636101062 ecr 3846260184], length 1380
10:30:18.249497 IP GLUBS.56284 > whatsapp-cdn-shv-01-gru1.fbcdn.net.https: Flags [.], ack 25985, win 552, options [nop,nop,TS val 3846260202 ecr 636101062], length 0
10:30:18.250417 IP whatsapp-cdn-shv-01-gru1.fbcdn.net.https > GLUBS.56284: Flags [.], seq 25985:27365, ack 872, win 265, options [nop,nop,TS val 636101063 ecr 3846260185], length 1380
10:30:18.250521 IP whatsapp-cdn-shv-01-gru1.fbcdn.net.https > GLUBS.56284: Flags [P.], seq 27365:28745, ack 872, win 265, options [nop,nop,TS val 636101063 ecr 3846260185], length 1380
10:30:18.250534 IP GLUBS.56284 > whatsapp-cdn-shv-01-gru1.fbcdn.net.https: Flags [.], ack 28745, win 552, options [nop,nop,TS val 3846260203 ecr 636101063], length 0
10:30:18.251400 IP whatsapp-cdn-shv-01-gru1.fbcdn.net.https > GLUBS.56284: Flags [.], seq 28745:30125, ack 872, win 265, options [nop,nop,TS val 636101064 ecr 3846260186], length 1380
10:30:18.251540 IP whatsapp-cdn-shv-01-gru1.fbcdn.net.https > GLUBS.56284: Flags [P.], seq 30125:31505, ack 872, win 265, options [nop,nop,TS val 636101064 ecr 3846260186], length 1380
10:30:18.251553 IP GLUBS.56284 > whatsapp-cdn-shv-01-gru1.fbcdn.net.https: Flags [.], ack 31505, win 552, options [nop,nop,TS val 3846260204 ecr 636101064], length 0
10:30:18.252546 IP whatsapp-cdn-shv-01-gru1.fbcdn.net.https > GLUBS.56284: Flags [.], seq 31505:32885, ack 872, win 265, options [nop,nop,TS val 636101065 ecr 3846260186], length 1380
10:30:18.252634 IP whatsapp-cdn-shv-01-gru1.fbcdn.net.https > GLUBS.56284: Flags [P.], seq 32885:34265, ack 872, win 265, options [nop,nop,TS val 636101065 ecr 3846260186], length 1380
10:30:18.252645 IP GLUBS.56284 > whatsapp-cdn-shv-01-gru1.fbcdn.net.https: Flags [.], ack 34265, win 552, options [nop,nop,TS val 3846260205 ecr 636101065], length 0
10:30:18.253651 IP whatsapp-cdn-shv-01-gru1.fbcdn.net.https > GLUBS.56284: Flags [.], seq 34265:35645, ack 872, win 265, options [nop,nop,TS val 636101067 ecr 3846260188], length 1380
10:30:18.253730 IP whatsapp-cdn-shv-01-gru1.fbcdn.net.https > GLUBS.56284: Flags [P.], seq 35645:37025, ack 872, win 265, options [nop,nop,TS val 636101067 ecr 3846260188], length 1380
10:30:18.253739 IP GLUBS.56284 > whatsapp-cdn-shv-01-gru1.fbcdn.net.https: Flags [.], ack 37025, win 552, options [nop,nop,TS val 3846260206 ecr 636101067], length 0
10:30:18.254736 IP whatsapp-cdn-shv-01-gru1.fbcdn.net.https > GLUBS.56284: Flags [.], seq 37025:38405, ack 872, win 265, options [nop,nop,TS val 636101068 ecr 3846260189], length 1380
10:30:18.254850 IP whatsapp-cdn-shv-01-gru1.fbcdn.net.https > GLUBS.56284: Flags [P.], seq 38405:39785, ack 872, win 265, options [nop,nop,TS val 636101068 ecr 3846260189], length 1380
10:30:18.254857 IP GLUBS.56284 > whatsapp-cdn-shv-01-gru1.fbcdn.net.https: Flags [.], ack 39785, win 552, options [nop,nop,TS val 3846260207 ecr 636101068], length 0
10:30:18.255877 IP whatsapp-cdn-shv-01-gru1.fbcdn.net.https > GLUBS.56284: Flags [.], seq 39785:41165, ack 872, win 265, options [nop,nop,TS val 636101069 ecr 3846260189], length 1380
10:30:18.255965 IP whatsapp-cdn-shv-01-gru1.fbcdn.net.https > GLUBS.56284: Flags [P.], seq 41165:42545, ack 872, win 265, options [nop,nop,TS val 636101069 ecr 3846260189], length 1380
10:30:18.255976 IP GLUBS.56284 > whatsapp-cdn-shv-01-gru1.fbcdn.net.https: Flags [.], ack 42545, win 552, options [nop,nop,TS val 3846260208 ecr 636101069], length 0
10:30:18.256999 IP whatsapp-cdn-shv-01-gru1.fbcdn.net.https > GLUBS.56284: Flags [.], seq 42545:43925, ack 872, win 265, options [nop,nop,TS val 636101070 ecr 3846260189], length 1380
10:30:18.257117 IP whatsapp-cdn-shv-01-gru1.fbcdn.net.https > GLUBS.56284: Flags [P.], seq 43925:45305, ack 872, win 265, options [nop,nop,TS val 636101070 ecr 3846260189], length 1380
10:30:18.257129 IP GLUBS.56284 > whatsapp-cdn-shv-01-gru1.fbcdn.net.https: Flags [.], ack 45305, win 552, options [nop,nop,TS val 3846260209 ecr 636101070], length 0
10:30:18.258111 IP whatsapp-cdn-shv-01-gru1.fbcdn.net.https > GLUBS.56284: Flags [.], seq 45305:46685, ack 872, win 265, options [nop,nop,TS val 636101071 ecr 3846260189], length 1380
10:30:18.258674 IP whatsapp-cdn-shv-01-gru1.fbcdn.net.https > GLUBS.56284: Flags [.], seq 46685:48065, ack 872, win 265, options [nop,nop,TS val 636101072 ecr 3846260189], length 1380
10:30:18.258688 IP GLUBS.56284 > whatsapp-cdn-shv-01-gru1.fbcdn.net.https: Flags [.], ack 48065, win 552, options [nop,nop,TS val 3846260211 ecr 636101071], length 0
10:30:18.258780 IP whatsapp-cdn-shv-01-gru1.fbcdn.net.https > GLUBS.56284: Flags [P.], seq 48065:49445, ack 872, win 265, options [nop,nop,TS val 636101072 ecr 3846260189], length 1380
10:30:18.262392 IP whatsapp-cdn-shv-01-gru1.fbcdn.net.https > GLUBS.56284: Flags [.], seq 49445:50825, ack 872, win 265, options [nop,nop,TS val 636101075 ecr 3846260199], length 1380
10:30:18.262414 IP GLUBS.56284 > whatsapp-cdn-shv-01-gru1.fbcdn.net.https: Flags [.], ack 50825, win 552, options [nop,nop,TS val 3846260215 ecr 636101072], length 0
10:30:18.262501 IP whatsapp-cdn-shv-01-gru1.fbcdn.net.https > GLUBS.56284: Flags [P.], seq 50825:52205, ack 872, win 265, options [nop,nop,TS val 636101075 ecr 3846260199], length 1380
10:30:18.262796 IP whatsapp-cdn-shv-01-gru1.fbcdn.net.https > GLUBS.56284: Flags [.], seq 52205:53585, ack 872, win 265, options [nop,nop,TS val 636101076 ecr 3846260199], length 1380
10:30:18.262806 IP GLUBS.56284 > whatsapp-cdn-shv-01-gru1.fbcdn.net.https: Flags [.], ack 53585, win 552, options [nop,nop,TS val 3846260215 ecr 636101075], length 0
10:30:18.262911 IP whatsapp-cdn-shv-01-gru1.fbcdn.net.https > GLUBS.56284: Flags [P.], seq 53585:54965, ack 872, win 265, options [nop,nop,TS val 636101076 ecr 3846260199], length 1380
10:30:18.263591 IP whatsapp-cdn-shv-01-gru1.fbcdn.net.https > GLUBS.56284: Flags [.], seq 54965:56345, ack 872, win 265, options [nop,nop,TS val 636101076 ecr 3846260199], length 1380
10:30:18.263598 IP GLUBS.56284 > whatsapp-cdn-shv-01-gru1.fbcdn.net.https: Flags [.], ack 56345, win 552, options [nop,nop,TS val 3846260216 ecr 636101076], length 0
10:30:18.263732 IP whatsapp-cdn-shv-01-gru1.fbcdn.net.https > GLUBS.56284: Flags [P.], seq 56345:57725, ack 872, win 265, options [nop,nop,TS val 636101076 ecr 3846260199], length 1380
10:30:18.263738 IP GLUBS.56284 > whatsapp-cdn-shv-01-gru1.fbcdn.net.https: Flags [.], ack 57725, win 574, options [nop,nop,TS val 3846260216 ecr 636101076], length 0
10:30:18.264380 IP whatsapp-cdn-shv-01-gru1.fbcdn.net.https > GLUBS.56284: Flags [.], seq 57725:59105, ack 872, win 265, options [nop,nop,TS val 636101077 ecr 3846260200], length 1380
10:30:18.264387 IP GLUBS.56284 > whatsapp-cdn-shv-01-gru1.fbcdn.net.https: Flags [.], ack 59105, win 597, options [nop,nop,TS val 3846260217 ecr 636101077], length 0
10:30:18.264496 IP whatsapp-cdn-shv-01-gru1.fbcdn.net.https > GLUBS.56284: Flags [P.], seq 59105:60485, ack 872, win 265, options [nop,nop,TS val 636101077 ecr 3846260200], length 1380
